{
  "schemaVersion": 1,
  "lectureId": "56 - More on Chap- 28-B.mp3",
  "provider": "sofer.ai",
  "transcriptionId": "9023c396-dd06-4e24-8227-7b244ca4de9e",
  "transcript": "transcripts/56%20-%20More%20on%20Chap-%2028-B.mp3.json",
  "fetchedAt": "2026-10-29T00:11:10.333Z",
  "request": {
    "monotone": true,
    "conclusion_bias": false
  },
  "topics": [
    {"title":"Seeing Godliness in Nature vs. Inside","starting_phrase":"So yeah, now we kind of only see one at a time and we only see it in like a limited way, and sometimes we see godliness more and sometimes we see it less.","start_time_sec":2.24,"matched_text":"yeah, now we kind of only see one at a time and we only see it in like a limited way, and sometimes we see godliness more and sometimes we see it less.","score_norm":0.918,"confidence":"HIGH","token_span":[1,34],"matched_content":16,"content_coverage":1,"longest_content_run_soft":9,"longest_content_run_strict":3},
    {"title":"Avoid Marveling at Man‑Made Greatness","starting_phrase":"I once heard such a thing that you're not supposed to be like מתבונן on man-made things for like גדלות הבורא.","start_time_sec":92.16,"matched_text":"once heard such a thing that you're not supposed to be like מתבונן on man-made things for like גדלות הבורא.","score_norm":0.793,"confidence":"HIGH","token_span":[291,311],"matched_content":11,"content_coverage":0.846,"longest_content_run_soft":7,"longest_content_run_strict":3},
    {"title":"Order, Chaos, and the Paradox of Beauty","starting_phrase":"But nowadays there people are starting to expand their view of that, and starting to appreciate that like really like chaos itself has an order, like the whole chaos theory, and like that there's a beauty in that itself","start_time_sec":196.22,"matched_text":"nowadays there people are starting to expand their view of that, and starting to appreciate that like really like chaos itself has an order, like the whole chaos theory, and like that there's a beauty in that itself,","score_norm":0.93,"confidence":"HIGH","token_span":[610,648],"matched_content":19,"content_coverage":1,"longest_content_run_soft":7,"longest_content_run_strict":3},
    {"title":"Lights of אצילות and the עשר ספירות בלי מה","starting_phrase":"And that's so this is why the lights of אצילות are still called עשר ספירות בלי מה, that even though it's already very tangible compared to א״ק, in other words, that now the God is being revealed in in in the lights of אצילות","start_time_sec":270.3730570905769,"matched_text":"that's so this is why the lights of אצילות are still called עשר ספירות בלי מה, that even though it's already very tangible compared to א״ק, in other words, that now the God is being revealed in in in the lights of אצילות","score_norm":0.937,"confidence":"HIGH","token_span":[853,896],"matched_content":23,"content_coverage":1,"longest_content_run_soft":17,"longest_content_run_strict":5},
    {"title":"Trees as a Reflection of Infinite Creation","starting_phrase":"How we see it in a tree? That, well, the way that we see it is really like the fact that that the tree is just is just really one example of the way the tree could be.","start_time_sec":403.08,"matched_text":"How we see it in a tree? That, well, the way that we see it is really like the fact that that the tree is just is just really one example of the way the tree could","score_norm":0.851,"confidence":"HIGH","token_span":[1221,1258],"matched_content":13,"content_coverage":1,"longest_content_run_soft":5,"longest_content_run_strict":2},
    {"title":"From Details to Generalities: Recognizing the כלל","starting_phrase":"And so that's where it becomes close to you, when you're able to like when you see it in the פרטים, that's where you see it in a way that's קרוב to you.","start_time_sec":557.36,"matched_text":"that's where it becomes close to you, when you're able to like when you see it in the פרטים, that's where you see it in a way that's קרוב","score_norm":0.937,"confidence":"HIGH","token_span":[1660,1689],"matched_content":16,"content_coverage":1,"longest_content_run_soft":9,"longest_content_run_strict":3}
  ]
}
