{
  "schemaVersion": 1,
  "lectureId": "54 - Chap- 28-8 Oros and Keilim (N) (End).mp3",
  "provider": "sofer.ai",
  "transcriptionId": "06e4affc-56a3-4d2d-8e47-c3954fd0a762",
  "transcript": "transcripts/54%20-%20Chap-%2028-8%20Oros%20and%20Keilim%20%28N%29%20%28End%29.mp3.json",
  "fetchedAt": "2026-10-29T00:10:53.347Z",
  "request": {
    "monotone": true,
    "conclusion_bias": false
  },
  "topics": [
    {"title":"The כלי as a Universal Vessel","starting_phrase":"And the truth is the main thing of the כלי is not when it comes to a particular expression just the fact that it's able to be used for anything.","start_time_sec":3.9,"matched_text":"truth is the main thing of the כלי is not when it comes to a particular expression just the fact that it's able to be used for anything.","score_norm":0.927,"confidence":"HIGH","token_span":[2,30],"matched_content":14,"content_coverage":1,"longest_content_run_soft":14,"longest_content_run_strict":2},
    {"title":"תיקון: Conveying Specific Ideas","starting_phrase":"Yeah, but before you make an actual movement the the the the the fact that it's able to transform it into a particular movement is the עניין of a is the עניין of a תיקון.","start_time_sec":93.38,"matched_text":"Yeah, but before you make an actual movement the the the the the fact that it's able to transform it into a particular movement is the ענין of a is the ענין of a תיקון.","score_norm":0.879,"confidence":"HIGH","token_span":[302,337],"matched_content":15,"content_coverage":1,"longest_content_run_soft":8,"longest_content_run_strict":2},
    {"title":"Prophetic Attire for Leaders and Messianic Figures","starting_phrase":"And it says when משיח comes, the people that that are נביאים are going to wear like קאפאטעס, they're going to wear like a a a long like an אפוד, like that long thing like the כהן גדול would wear, so that people would know to go ask them questions.","start_time_sec":262.64,"matched_text":"says when משיח comes, the people that that are נביאים are going to wear like קאפאטעס, they're going to wear like a a a long like an אפוד, like that long thing like the כהן גדול would wear, so that people would know to go ask them questions.","score_norm":0.94,"confidence":"HIGH","token_span":[905,953],"matched_content":26,"content_coverage":1,"longest_content_run_soft":14,"longest_content_run_strict":4},
    {"title":"Divine Clothing Metaphors in Scripture","starting_phrase":"So, the same thing, like like it says that by קריעת ים סוף they saw השם as like this young warrior, and by מתן תורה they saw Him as this old sage.","start_time_sec":412.62,"matched_text":"same thing, like like it says that by קריעת ים סוף they saw השם as like this young warrior, and by מתן תורה they saw Him as this old sage.","score_norm":0.941,"confidence":"HIGH","token_span":[1441,1471],"matched_content":16,"content_coverage":1,"longest_content_run_soft":8,"longest_content_run_strict":3},
    {"title":"Vessels Bridging Inner and Outer Revelation","starting_phrase":"So, the vessels bridge the gap on the Because the פנימיות of them reveal Him, because only God could create.","start_time_sec":519.72,"matched_text":"vessels bridge the gap on the Because the פנימיות of them reveal Him, because only God could create.","score_norm":0.972,"confidence":"HIGH","token_span":[1834,1852],"matched_content":13,"content_coverage":1,"longest_content_run_soft":13,"longest_content_run_strict":8}
  ]
}
