{
  "schemaVersion": 1,
  "lectureId": "022 Tape004-Side2-Ch4.mp3",
  "provider": "sofer.ai",
  "transcriptionId": "be38e254-cdab-4c61-9ff4-57514724f62d",
  "transcript": "transcripts/022%20Tape004-Side2-Ch4.mp3.json",
  "fetchedAt": "2026-10-29T00:35:04.060Z",
  "request": {
    "monotone": true,
    "conclusion_bias": false
  },
  "topics": [
    {"title":"Introducing פרט vs. כלל in Study","starting_phrase":"Yeah, okay, פרק ד. This is the פרק about the פרט, that's what we want, that you have to learn it in a particular manner.","start_time_sec":3.7399999999999984,"matched_text":"Yeah, okay, פרק ד. This is the פרק about the פרט, that's what we want, that you have to learn it in a particular manner.","score_norm":0.934,"confidence":"HIGH","token_span":[0,25],"matched_content":13,"content_coverage":1,"longest_content_run_soft":8,"longest_content_run_strict":3},
    {"title":"Understanding General Contemplation (דרך כלל)","starting_phrase":"And now by השגת ממלא כל עלמין עיקר יחודא עילאה יחודא תתאה, so there's basically the ענינים of יחודא עילאה and יחודא תתאה, you can basically discuss in a general manner.","start_time_sec":222.22,"matched_text":"השגת ממלא כל עלמין עיקר יחודא עילאה יחודא תתאה, so there's basically the ענינים of יחודא עילאה and יחודא תתאה, you can basically discuss in a general manner.","score_norm":0.977,"confidence":"HIGH","token_span":[514,542],"matched_content":21,"content_coverage":1,"longest_content_run_soft":21,"longest_content_run_strict":9},
    {"title":"Advantages of Particular Contemplation (דרך פרט)","starting_phrase":"There's a מעלה בהתבוננות דרך פרט, דווקא, מצד עוצם הקירוב גילוי אור אלקי בנפשו יותר, because this brings the revelation of the light to his soul much closer.","start_time_sec":421.4112195121951,"matched_text":"מעלה בהתבוננות דרך פרט, דווקא, מצד עוצם הקירוב גילוי אור אלקי בנפשו יותר, because this brings the revelation of the light to his soul much closer.","score_norm":0.948,"confidence":"HIGH","token_span":[1067,1093],"matched_content":21,"content_coverage":0.955,"longest_content_run_soft":21,"longest_content_run_strict":14},
    {"title":"Ascending the Ladder of Worlds","starting_phrase":"And then once he understands how from the שמרה האופנים comes out the actual physical world","start_time_sec":1001.76,"matched_text":"once he understands how from the שמרה האופנים comes out the actual physical world,","score_norm":0.981,"confidence":"HIGH","token_span":[2564,2578],"matched_content":11,"content_coverage":1,"longest_content_run_soft":11,"longest_content_run_strict":4},
    {"title":"Everyday Example: Gas Bill and Weather","starting_phrase":"Now now this is this is something that's ממש affecting me.","start_time_sec":1163.8312195121955,"matched_text":"something that's ממש affecting me.","score_norm":1,"confidence":"HIGH","token_span":[2964,2969],"matched_content":5,"content_coverage":1,"longest_content_run_soft":5,"longest_content_run_strict":5},
    {"title":"Airplane Analogy for Knowing Details","starting_phrase":"have an airplane. Right. In other words, this is the this is ענין is the same thing,","start_time_sec":1495.62,"matched_text":"have an airplane. Right. In other words, this is the this is ענין is the same thing,","score_norm":0.893,"confidence":"HIGH","token_span":[3838,3855],"matched_content":7,"content_coverage":1,"longest_content_run_soft":4,"longest_content_run_strict":2},
    {"title":"Learning Fundamentals Before Practicing a Profession","starting_phrase":"You know. Right. So, he says this has nothing to do with anything.","start_time_sec":1599.04,"matched_text":"says this has nothing to do with anything.","score_norm":0.977,"confidence":"HIGH","token_span":[4116,4124],"matched_content":6,"content_coverage":1,"longest_content_run_soft":6,"longest_content_run_strict":3},
    {"title":"Connecting the Ten Sephirot and Their Faces","starting_phrase":"and all the פרטי עשר ספירות ופרצופים וזו״ן ואו״א ואריך אנפין ועתיק יומין, how they work and how each one connects with the other one.","start_time_sec":1670.42,"matched_text":"פרטי עשר ספירות ופרצופים וזו״ן ואו״א ואריך אנפין ועתיק יומין, how they work and how each one connects with the other one.","score_norm":0.951,"confidence":"HIGH","token_span":[4310,4332],"matched_content":19,"content_coverage":0.95,"longest_content_run_soft":19,"longest_content_run_strict":11},
    {"title":"Concept of the Infinite Light Explained","starting_phrase":"And then it's not just the things that, well, there's an infinite light.","start_time_sec":1735.08,"matched_text":"it's not just the things that, well, there's an infinite light.","score_norm":0.957,"confidence":"HIGH","token_span":[4497,4508],"matched_content":7,"content_coverage":1,"longest_content_run_soft":7,"longest_content_run_strict":2}
  ]
}
