{
  "schemaVersion": 1,
  "lectureId": "38 - Chap- 26-9 Yichudei AvA (End).mp3",
  "provider": "sofer.ai",
  "transcriptionId": "09ea4d5d-8301-4dea-9e32-b1340dac84e3",
  "transcript": "transcripts/38%20-%20Chap-%2026-9%20Yichudei%20AvA%20%28End%29.mp3.json",
  "fetchedAt": "2026-10-29T00:08:23.265Z",
  "request": {
    "monotone": true,
    "conclusion_bias": false
  },
  "topics": [
    {"title":"Explanation of קל עליון concept","starting_phrase":"וזהו ענין קל עליון, this idea of","start_time_sec":4.460000000000001,"matched_text":"וזהו ענין קל עליון, this idea","score_norm":0.985,"confidence":"HIGH","token_span":[0,6],"matched_content":5,"content_coverage":1,"longest_content_run_soft":5,"longest_content_run_strict":4},
    {"title":"Acquisition (קונה הכל) and birthing separate entities","starting_phrase":"And then it's idea if it's קונה הכל,","start_time_sec":87.61080624187255,"matched_text":"it's idea if it's קונה הכל,","score_norm":0.984,"confidence":"HIGH","token_span":[233,239],"matched_content":5,"content_coverage":1,"longest_content_run_soft":5,"longest_content_run_strict":3},
    {"title":"Remembering the kindness of the fathers (חסדי אבות)","starting_phrase":"וזהו וזוכר חסדי אבות ומביא גואל","start_time_sec":162.73241872561772,"matched_text":"וזהו וזוכר חסדי אבות ומביא גואל","score_norm":1,"confidence":"HIGH","token_span":[511,517],"matched_content":6,"content_coverage":1,"longest_content_run_soft":6,"longest_content_run_strict":6},
    {"title":"Parable of the supreme wise person","starting_phrase":"והמשל בזה ידוע, the משל of this is known","start_time_sec":226.38,"matched_text":"והמשל בזה ידוע, the משל of this is known,","score_norm":0.948,"confidence":"HIGH","token_span":[703,712],"matched_content":5,"content_coverage":1,"longest_content_run_soft":4,"longest_content_run_strict":3},
    {"title":"Teaching as key to understanding חסידות","starting_phrase":"So that's why the best thing, if you want","start_time_sec":366.24,"matched_text":"that's why the best thing, if you want","score_norm":0.955,"confidence":"HIGH","token_span":[1191,1199],"matched_content":5,"content_coverage":1,"longest_content_run_soft":5,"longest_content_run_strict":2}
  ]
}
