{
  "schemaVersion": 1,
  "lectureId": "41 - Chap- 27-3 Oros and Keilim (M).mp3",
  "provider": "sofer.ai",
  "transcriptionId": "65a886a1-7a04-44ea-a64c-2cc3d7c19615",
  "transcript": "transcripts/41%20-%20Chap-%2027-3%20Oros%20and%20Keilim%20%28M%29.mp3.json",
  "fetchedAt": "2026-10-29T00:08:57.293Z",
  "request": {
    "monotone": true,
    "conclusion_bias": false
  },
  "topics": [
    {"title":"Three Supernal Rulers and Body Systems","starting_phrase":"Okay, וביאור הדברים ידוע, the explanation of these matters","start_time_sec":4.219999999999999,"matched_text":"וביאור הדברים ידוע, the explanation of these matters","score_norm":0.961,"confidence":"HIGH","token_span":[1,9],"matched_content":5,"content_coverage":1,"longest_content_run_soft":5,"longest_content_run_strict":3},
    {"title":"Neshama Resides in the Brain","starting_phrase":"The נשמה במוחא, the the the נשמה, which","start_time_sec":76.34,"matched_text":"הנשמה במוחא, the the the נשמה, which","score_norm":0.885,"confidence":"HIGH","token_span":[165,172],"matched_content":4,"content_coverage":1,"longest_content_run_soft":2,"longest_content_run_strict":2},
    {"title":"Vital Organs: Liver, Heart, and Kidneys","starting_phrase":"In medicine there are three vital organs that if a person","start_time_sec":169.98,"matched_text":"medicine there are three vital organs that if a person","score_norm":0.951,"confidence":"HIGH","token_span":[402,412],"matched_content":6,"content_coverage":1,"longest_content_run_soft":5,"longest_content_run_strict":3},
    {"title":"The Liver: Body’s Ultimate Processor","starting_phrase":"The liver takes all that stuff apart, and breaks it down","start_time_sec":322.74,"matched_text":"liver takes all that stuff apart, and breaks it down","score_norm":0.969,"confidence":"HIGH","token_span":[814,824],"matched_content":7,"content_coverage":1,"longest_content_run_soft":7,"longest_content_run_strict":3},
    {"title":"Chaya Yechida Beyond Physical Vessels","starting_phrase":"אבל בחינת חיה יחידה הוא למעלה מהגבלת הכלים וכולו.","start_time_sec":512.4901349831271,"matched_text":"בחינת חיה יחידה הוא למעלה מהגבלת הכלים וכולו.","score_norm":1,"confidence":"HIGH","token_span":[1388,1396],"matched_content":8,"content_coverage":1,"longest_content_run_soft":8,"longest_content_run_strict":8}
  ]
}
