{
  "schemaVersion": 1,
  "lectureId": "82 - Chap- 22-2 Hiskalelus of Sefiros.mp3",
  "provider": "sofer.ai",
  "transcriptionId": "73becb1a-4c3d-4cb9-bed7-c303be49fd7b",
  "transcript": "transcripts/82%20-%20Chap-%2022-2%20Hiskalelus%20of%20Sefiros.mp3.json",
  "fetchedAt": "2026-10-28T23:59:43.759Z",
  "request": {
    "monotone": true,
    "conclusion_bias": false
  },
  "topics": [
    {"title":"Types of Inclusion and Nullification in Opposition","starting_phrase":"So we just finished saying how each ספירה divides into ten","start_time_sec":4.56,"matched_text":"finished saying how each ספירה divides into ten","score_norm":1,"confidence":"HIGH","token_span":[3,11],"matched_content":8,"content_coverage":1,"longest_content_run_soft":8,"longest_content_run_strict":8},
    {"title":"Merit Nullified into Guilt","starting_phrase":"So that is like what we talked about in the parentheses before","start_time_sec":268.22,"matched_text":"what we talked about in the parentheses before,","score_norm":0.959,"confidence":"HIGH","token_span":[574,582],"matched_content":5,"content_coverage":1,"longest_content_run_soft":5,"longest_content_run_strict":2},
    {"title":"Rachel's Sacrifice Becomes Greater Merit","starting_phrase":"And the opposite way in the שיחה of רחל אמנו, that יעקב said to יוסף","start_time_sec":339.28,"matched_text":"opposite way in the שיחה of רחל אמנו, that יעקב said to יוסף,","score_norm":0.957,"confidence":"HIGH","token_span":[788,801],"matched_content":8,"content_coverage":1,"longest_content_run_soft":8,"longest_content_run_strict":2},
    {"title":"Hidden Opposite Within the Opponent","starting_phrase":"And the only reason why this is possible, this is a complete ביטול of the opposite side","start_time_sec":429.16,"matched_text":"only reason why this is possible, this is a complete ביטול of the opposite side,","score_norm":0.937,"confidence":"HIGH","token_span":[1006,1021],"matched_content":8,"content_coverage":1,"longest_content_run_soft":4,"longest_content_run_strict":3},
    {"title":"Never-sinned vs Baal Teshuva Mindset","starting_phrase":"This is the difference between like somebody that never sinned and a בעל תשובה","start_time_sec":502.54,"matched_text":"difference between like somebody that never sinned and a בעל תשובה.","score_norm":0.959,"confidence":"HIGH","token_span":[1205,1216],"matched_content":7,"content_coverage":1,"longest_content_run_soft":7,"longest_content_run_strict":2}
  ]
}
