{
  "schemaVersion": 1,
  "lectureId": "018 Tape002-Side2-Ch2.mp3",
  "provider": "sofer.ai",
  "transcriptionId": "09f64068-87e7-4a1d-aaaf-de4f1491770a",
  "transcript": "transcripts/018%20Tape002-Side2-Ch2.mp3.json",
  "fetchedAt": "2026-10-29T02:40:07.756Z",
  "request": {
    "monotone": true,
    "conclusion_bias": false
  },
  "topics": [
    {"title":"Intro and Levels of Bina and Tevuna","starting_phrase":"Welcome to the Chabad House. Okay, you ready with a with a tape recording and everything? Okay.","start_time_sec":0,"matched_text":"Welcome to the Chabad House. Okay, you ready with a with a tape recording and everything?","score_norm":0.951,"confidence":"HIGH","token_span":[0,16],"matched_content":9,"content_coverage":1,"longest_content_run_soft":9,"longest_content_run_strict":2},
    {"title":"Analogy of Deep Water: Ish Tevuna vs Ish Bina","starting_phrase":"And by the way, this also comes דוקא from the התבוננות.","start_time_sec":67.06,"matched_text":"way, this also comes דוקא from the התבוננות.","score_norm":0.976,"confidence":"HIGH","token_span":[115,123],"matched_content":6,"content_coverage":1,"longest_content_run_soft":6,"longest_content_run_strict":4},
    {"title":"Two Methods: Bringing Water to Sheep or Submerging Sheep","starting_phrase":"So there's two things you can do: you can either take each sheep","start_time_sec":201.84,"matched_text":"there's two things you can do: you can either take each sheep","score_norm":0.986,"confidence":"HIGH","token_span":[409,421],"matched_content":10,"content_coverage":1,"longest_content_run_soft":10,"longest_content_run_strict":5},
    {"title":"Power of Bina versus Power of Tevuna","starting_phrase":"In other words, this is not the actual כח of the בינה.","start_time_sec":430.08,"matched_text":"other words, this is not the actual כח of the בינה.","score_norm":0.937,"confidence":"HIGH","token_span":[987,998],"matched_content":6,"content_coverage":1,"longest_content_run_soft":6,"longest_content_run_strict":2},
    {"title":"Length vs Width: Bina as Breadth, Tevuna as Length","starting_phrase":"And by the way, that's that's the secret of the two לויתןs.","start_time_sec":554.9,"matched_text":"way, that's that's the secret of the two לויתןs.","score_norm":0.965,"confidence":"HIGH","token_span":[1336,1345],"matched_content":6,"content_coverage":1,"longest_content_run_soft":6,"longest_content_run_strict":3},
    {"title":"Greek Intellectual Bina vs American Applied Tevuna","starting_phrase":"The Greek power was a power of בינה.","start_time_sec":740.5807494955318,"matched_text":"Greek power was a power of בינה.","score_norm":0.941,"confidence":"HIGH","token_span":[1718,1725],"matched_content":4,"content_coverage":1,"longest_content_run_soft":4,"longest_content_run_strict":2},
    {"title":"Societal Application: From Theory to Practice","starting_phrase":"So you can have a person where the whole thing, and we see not just a person","start_time_sec":996.46,"matched_text":"can have a person where the whole thing, and we see not just a person,","score_norm":0.95,"confidence":"HIGH","token_span":[2302,2317],"matched_content":9,"content_coverage":1,"longest_content_run_soft":9,"longest_content_run_strict":2},
    {"title":"Future Discussion: Letters of Thought from Tevuna","starting_phrase":"And this is what he's he's starting up what he's going to discuss later in the book","start_time_sec":1338.578106082441,"matched_text":"what he's he's starting up what he's going to discuss later in the book,","score_norm":0.981,"confidence":"HIGH","token_span":[3403,3417],"matched_content":11,"content_coverage":1,"longest_content_run_soft":11,"longest_content_run_strict":8}
  ]
}
